{
  "schema": "MigrAves-RBM",
  "schema_version": "1.0",
  "record_id": "RBM-CHM-001-20260717-EXAMPLE",
  "generated_at": "2026-07-17T22:30:00.000Z",
  "area": {
    "schema": "MigrAves-ABM",
    "schema_version": "1.0",
    "area_id": "ABM-CHM-001",
    "name": "Humedal de Chamiza",
    "ecosystem_type": "coastal_wetland",
    "region": "Los Lagos, Chile",
    "geometry": { "type": "Point", "coordinates": [-72.8403, -41.4807], "monitored_radius_km": 1.2 },
    "priority_species_or_groups": ["Zarapitos", "Aves playeras migratorias"],
    "historical_baseline": {
      "period": "2016-2025",
      "description": "Llegada habitual entre el 12 y el 20 de octubre; mediana histórica de 80 aves durante esta ventana."
    },
    "governance": { "primary_role": "research_team", "data_access": "open" },
    "created_at": null
  },
  "observation": {
    "observed_at": "2026-10-04T09:30",
    "field_note": "Marea baja y visibilidad buena.",
    "evidence": { "image_filename": "demo-chamiza.svg", "image_stored_in_export": false },
    "estimated_total_birds": 96,
    "visible_groups": 4,
    "primary_taxon": "Aves playeras, identificación tentativa",
    "species_or_groups": 3,
    "observed_behaviors": ["forrajeo", "descanso", "vuelo en bandada"],
    "detections": []
  },
  "environment": {
    "microclimate": {
      "temperature_c": 12.8,
      "humidity_percent": 81,
      "pressure_hpa": 1006.4,
      "wind_speed_kmh": 18.2,
      "rainfall_24h_mm": 4.6,
      "uv_index": 2.1,
      "soil_moisture_percent": 63,
      "water_level": "low"
    },
    "bioacoustic_metadata": {
      "events_per_minute": 27,
      "dominant_group": "Aves playeras / shorebirds",
      "note": "Sensor metadata only; no audio file was analyzed by this MVP."
    }
  },
  "historical_comparison": {
    "baseline_available": true,
    "arrival_timing_delta_days": -8,
    "abundance_delta_percent": 20,
    "water_level_delta": "-12% estimated",
    "interpretation": "Repeated comparable sampling is required."
  },
  "climate_response_index": {
    "score": 72,
    "level": "moderate",
    "confidence": 0.79,
    "components": { "phenology": 78, "abundance": 56, "habitat": 74, "weather": 68 },
    "interpretation": "Experimental index; not an official climate indicator."
  },
  "interpretation": {
    "summary": "This is a monitoring signal, not proof of climate causality.",
    "recommended_action": "Repeat comparable counts and validate taxonomy.",
    "limitations": ["Demo data", "Pending human validation"]
  },
  "provenance": {
    "image": "simulated_demo",
    "microclimate": "simulated_demo",
    "bioacoustic": "simulated_demo_metadata",
    "baseline": "area_defined_baseline",
    "biological_analysis": "ai_estimate_pending_human_validation",
    "software": "MigrAves Climate Sentinel MVP"
  },
  "validation": {
    "status": "pending",
    "reviewer_name": "",
    "reviewer_role": "",
    "corrected_taxon": "",
    "note": "",
    "reviewed_at": null,
    "data_quality_level": "N2",
    "data_quality_label": "AI estimate"
  }
}
